{
    "schemaVersion": 1, "locale": "vi", "cycleId": "vi-20260819T185700589Z",
    "resourceProfile": { "classification": "standard", "assessment": "Canonical English, the complete Vietnamese locale, prior critique, and UI context were available locally." },
    "review": {
        "automatedQuality": { "state": "passed", "summary": "Translation review, queue validation, type checking, focused tests, and the production preview build passed." },
        "linguisticCritique": { "state": "completed", "summary": "A fresh Vietnamese critique found five catalog labels using food, electrical-load, or ungrammatical literal wording." },
        "competentHumanReview": { "state": "pending", "summary": "No competent Vietnamese human review was performed; corrections remain machine reviewed." },
        "publicationAuthorization": { "state": "not-requested", "summary": "The owner requested correction commits, not publication or deployment." }
    },
    "findings": [{ "id": "vi-catalog-metadata", "translationId": "shared.encyclopediaDetail.breadcrumb", "category": "translation-defect", "severity": "medium", "summary": "Five navigation and research-record labels used unrelated or ungrammatical literal senses.", "disposition": "resolved", "evidence": ["The strings label navigation, chart loading, and catalog documentation metadata."], "resolution": "Used natural Vietnamese UI and catalog terminology." }]
}
