{
    "schemaVersion": 1,
    "locale": "bn",
    "cycleId": "bn-20260819T183017738Z",
    "resourceProfile": {
        "classification": "standard",
        "assessment": "Canonical English, the complete Bengali source scope, glossary, review metadata, and UI context were available locally."
    },
    "review": {
        "automatedQuality": {
            "state": "passed",
            "summary": "Translation review generation, queue validation, type checking, focused tests, the production build, route checks, and generated-link validation passed."
        },
        "linguisticCritique": {
            "state": "completed",
            "summary": "A fresh complete-scope Bengali critique found protected Wire Wizard identity drift and residual anatomical coil-leg wording."
        },
        "competentHumanReview": {
            "state": "pending",
            "summary": "The changed entries were corrected by machine review and still require competent Bengali human review."
        },
        "publicationAuthorization": {
            "state": "not-requested",
            "summary": "This cycle authorizes a locale-specific commit only, not publication or deployment."
        }
    },
    "findings": [
        {
            "id": "bn-wire-wizard-identity",
            "translationId": "messages.home.tools.wirewiz.label",
            "category": "translation-defect",
            "severity": "high",
            "summary": "Wire Wizard was transliterated in the home, TCR, and Wire Wizard interfaces instead of preserving the protected product name.",
            "disposition": "resolved",
            "evidence": ["The translation contract protects product identity."],
            "resolution": "Restored Wire Wizard verbatim in every affected runtime label."
        },
        {
            "id": "bn-coil-lead-terminology",
            "translationId": "calculators.coil.legLength",
            "category": "translation-defect",
            "severity": "high",
            "summary": "Coil lead length still used the ordinary anatomical word for a leg in Coil and Wire Wizard.",
            "disposition": "resolved",
            "evidence": ["The controls describe the connection-lead portions of resistance wire."],
            "resolution": "Used সংযোগ লিড consistently for lead length, loss, and the remaining-wire warning."
        }
    ]
}
