{
    "schemaVersion": 1,
    "locale": "el",
    "cycleId": "el-20260819T083033546Z",
    "resourceProfile": {
        "classification": "standard",
        "assessment": "The complete English and Greek source scope, review metadata, glossary, and project concept references were available locally."
    },
    "review": {
        "automatedQuality": { "state": "passed", "summary": "Translation review generation, TypeScript typecheck, production build, route checks, and generated internal-link validation passed." },
        "linguisticCritique": { "state": "completed", "summary": "A bounded Greek pass found no new actionable translation defects; the established trigonometry terminology is internally consistent across the reviewed scope." },
        "competentHumanReview": { "state": "pending", "summary": "No competent Greek human review was performed in this cycle; the locale remains pending human review." },
        "publicationAuthorization": { "state": "owner-authorized", "reviewer": "LarsSimonsen", "summary": "Publication was explicitly authorized by LarsSimonsen in the current task request; competent human review remains pending." }
    },
    "findings": []
}
